7632,671610787557222123,https://www.airbnb.com/rooms/671610787557222123,20240911015603,2024-09-11,city scrape,"Deluxe Zimmer in ""Pension Mozart"" im Zentrum Wiens","The deluxe room with private bathroom + toilet is equipped with a king size bed, kettle, coffee machine, hairdryer and a smart TV with streaming services. In the common area you will find 2 guest toilets, 2 balconies and a beverage vending machine.<br /><br />Our family-run guesthouse Mozart is connected with a tradition of over 100 years. It has been completely renovated in 2021 and offers an easy contactless check-in 24/7.","Mariahilfer Straße, Museum Quarter, House of the Sea, City Center",https://a0.muscache.com/pictures/miso/Hosting-671610787557222123/original/2238d632-924b-4e00-ac6c-ea83191421ef.jpeg,138176292,https://www.airbnb.com/users/show/138176292,Igor,2017-07-02,"Vienna, Austria",,within an hour,100%,100%,f,https://a0.muscache.com/im/pictures/user/User-138176292/original/c7c84971-46e4-4bb0-bbd1-551ab5cefee1.jpeg?aki_policy=profile_small,https://a0.muscache.com/im/pictures/user/User-138176292/original/c7c84971-46e4-4bb0-bbd1-551ab5cefee1.jpeg?aki_policy=profile_x_medium,,4.0,4.0,"['email', 'phone']",t,t,"Vienna, Wien, Austria",Mariahilf,,48.2001755,16.3589309,Room in boutique hotel,Private room,4,1.5,1.5 baths,1.0,2.0,"[""Hot water kettle"", ""Cleaning products"", ""First aid kit"", ""Bed linens"", ""Hangers"", ""Self check-in"", ""Cleaning available during stay"", ""Shared patio or balcony"", ""Portable fans"", ""Long term stays allowed"", ""Coffee maker"", ""Elevator"", ""Wifi"", ""Paid parking garage off premises"", ""Shampoo"", ""Central heating"", ""Clothing storage: wardrobe"", ""Shower gel"", ""Essentials"", ""Fire extinguisher"", ""Dedicated workspace"", ""Body soap"", ""Room-darkening shades"", ""Hair dryer"", ""Lockbox"", ""HDTV with Amazon Prime Video, Netflix, standard cable"", ""Luggage dropoff allowed"", ""Laundromat nearby"", ""Hot water"", ""Paid crib - available upon request"", ""Mini fridge"", ""Clamp on table seat high chair - always at the listing"", ""Smoke alarm"", ""Single level home""]",$181.00,1,365,1,4,999,999,1.2,999.0,,t,12,41,69,328,2024-09-11,1,1,0,2023-10-24,2023-10-24,4.0,4.0,2.0,5.0,5.0,5.0,3.0,,t,4,2,2,0,0.09
11422,1075135580624124643,https://www.airbnb.com/rooms/1075135580624124643,20240911015603,2024-09-11,city scrape,Nearby Westbahnhof and Mariahilferstraße,"Our apartment in the heart of Vienna, offers not only a spacious furnishings with 8 beds, but also a fully equipped kitchen where you can cook a delicious breakfast. Linen and covers are included. The bathroom is also equipped with towels, shampoo, shower gel, soap, and co.","Subway - U4 U6/U6/U-Bahn <br />- Westbahnhof<br />Busse - 12A, 7A, N8, VAL1 <br /><br />Restaurant recommendations / Restaurant recommendations<br />-Hühnerparadies<br />-Hawidere Bier Burger Bar<br />-Café Alarad<br />-5 Haus<br />-Das Eduard<br />-Pizzeria Mafiosi<br />-Cafe Plauscherl<br />-Gasthaus Quell<br />-Espresso ""Zum Schwarzen Flamingo""<br />-GOTA Coffee Experts<br />-Restaurant OTTO Weingartshofer<br />-Zucchero<br />-Grätzlheuriger<br />-Velani<br />-Pizzeria Pummarò<br />-Berliner Babo Meidling<br />-Gleis//Garden<br /><br />Sightseeing / Attractions -Pedfinder<br />Museum and Institute of Scout History<br />-Ernst Fuchs Museum<br />-Maria vom Siege<br />-Jugendstiltheater",https://a0.muscache.com/pictures/cc26e09f-8b33-4272-bbd5-e60caeec2757.jpg,8683326,https://www.airbnb.com/users/show/8683326,Christian,2013-09-07,"Vienna, Austria","Als geborener und stolzer Wiener habe ich ein Gefühl für diese Stadt und was sie ausmacht - und Wien ist eine suuupergeile Stadt. Ich selbst reise gern unabhängig mit dem Auto oder wenn weiter, auch mit dem Flieger. In jedem Fall ziehe ich privat auch ein gemütliches Apartment, einem Hotelbetrieb vor. Meine Hobbys sind Kochen und jede Art von Sport, wie Tennis, Badminton, Rafting, Wandern, Schwimmen, Radfahren, Surfen, Golfen....und als Österreicher natürlich Skifahren.
In meinem Leben begleiten mich zwei Leitsprüche: 
Nr.1/ Setze Dir den Hut des Anderen auf, und Nr.2/ Wenn es stürmisch wird, lerne im Regen zu tanzen.
Auf meine Kinder Lisa (23)  und Lukas (17) bin ich sehr stolz. Die beiden sind ein immer gegenwärtiger und wichtiger Bestandteil meines Lebens. 
",within an hour,100%,94%,f,https://a0.muscache.com/im/pictures/user/User-8683326/original/fc94ef91-673f-4f05-9db6-8a6e36d9627f.jpeg?aki_policy=profile_small,https://a0.muscache.com/im/pictures/user/User-8683326/original/fc94ef91-673f-4f05-9db6-8a6e36d9627f.jpeg?aki_policy=profile_x_medium,,7.0,9.0,"['email', 'phone', 'work_email']",t,t,"Vienna, Wien, Austria",Rudolfsheim-Fnfhaus,,48.1894534,16.3334914,Entire rental unit,Entire home/apt,8,1.0,1 bath,2.0,4.0,"[""First aid kit"", ""Heating"", ""Self check-in"", ""Cooking basics"", ""Carbon monoxide alarm"", ""Courtyard view"", ""Coffee maker"", ""TV"", ""Pets allowed"", ""Wifi"", ""Kitchen"", ""Dedicated workspace"", ""Washer"", ""Outdoor playground"", ""Hair dryer"", ""Lockbox"", ""Dishes and silverware"", ""Air conditioning"", ""Board games"", ""Smoke alarm"", ""Refrigerator"", ""Free parking on premises""]",$145.00,1,365,1,2,1125,1125,1.7,1125.0,,t,2,3,3,21,2024-09-11,4,4,0,2024-04-20,2024-08-04,3.5,4.25,2.75,3.75,4.25,4.0,3.5,,t,7,7,0,0,0.83
11441,1059499568638550503,https://www.airbnb.com/rooms/1059499568638550503,20240911015603,2024-09-11,city scrape,"Nice room in shared ap-t nxt city center, metro U2","From this centrally located accommodation, you are in all important places in no time at all.",,https://a0.muscache.com/pictures/hosting/Hosting-1059499568638550503/original/d6dad9ce-f4f5-4108-b528-d0f802731a99.jpeg,535114363,https://www.airbnb.com/users/show/535114363,Khurshed,2023-09-02,,,within an hour,100%,100%,f,https://a0.muscache.com/defaults/user_pic-50x50.png?v=3,https://a0.muscache.com/defaults/user_pic-225x225.png?v=3,,2.0,12.0,['phone'],f,t,,Leopoldstadt,,48.21905,16.38236,Private room in rental unit,Private room,2,1.0,1 bath,1.0,1.0,"[""Dryer"", ""Washer"", ""Hot water"", ""First aid kit"", ""Wifi"", ""Heating"", ""Bed linens"", ""Fire extinguisher"", ""Lock on bedroom door"", ""Dedicated workspace""]",$19.00,30,90,30,30,90,90,30.0,90.0,,t,12,36,66,66,2024-09-11,13,13,1,2024-03-11,2024-09-02,3.23,3.92,2.54,3.46,3.85,4.54,3.85,,t,2,0,2,0,2.11
11767,1082591190541952398,https://www.airbnb.com/rooms/1082591190541952398,20240911015603,2024-09-11,previous scrape,Metropolitan Charm: Stylish 2+1 Apt@ Vienna's Core,"Cozy and spacious 2+1 apartment in Vienna's embassy district, just 3 minutes from Wien Rennweg station. Centrally located, it offers a perfect blend of convenience and comfort for an ideal city experience.<br /><br />We offer EXCLUSIVELY:<br /><br />✔ Self check-in<br />✔ Coffee machine<br />✔ High-speed internet<br />✔ Smart TV including Netflix<br />✔ Fully equipped kitchen<br />✔ Comfortable beds and pillows<br />✔ Shower & Washer<br />✔ High-quality toiletries<br />✔ Affordable parking for €7/day<br />✔ €2 per booking for donations","The third district of Vienna is situated in the vibrant heart of the city, just a 10-minute journey from the bustling city center. Within minutes, you can reach a plethora of restaurants and shopping destinations, including the renowned Wien Mitte - The Mall. Additionally, the iconic Vienna City Park is merely a single train stop away, offering a scenic retreat. Furthermore, you're conveniently located only two stops away from Wien Hauptbahnhof, main train station, providing easy access to transportation hubs. <br /><br />Some of our recommended places:<br /><br />✔  Falkensteiner Stüberl<br />✔  Pizzeria Pozzuoli <br />✔  Benkei Restaurant<br />✔ Donnersmarkt Restaurant & Bar",https://a0.muscache.com/pictures/miso/Hosting-1082591190541952398/original/09b7c670-1bf0-4d3c-abf6-036268e29878.jpeg,88128342,https://www.airbnb.com/users/show/88128342,Fabian,2016-08-05,"Vienna, Austria","Easy-going human being who loves to interact with others. Smiling is my strength and friendliness is my duty.

- 2€ of every booking goes charity",within an hour,100%,100%,,https://a0.muscache.com/im/pictures/user/User-88128342/original/f96786a9-26a9-4266-aedd-5b5af241457d.jpeg?aki_policy=profile_small,https://a0.muscache.com/im/pictures/user/User-88128342/original/f96786a9-26a9-4266-aedd-5b5af241457d.jpeg?aki_policy=profile_x_medium,,120.0,489.0,"['email', 'phone']",t,t,"Vienna, Wien, Austria",Landstra§e,,48.19358,16.38794,Entire rental unit,Entire home/apt,5,,1.5 baths,2.0,,"[""Dining table"", ""Hot water kettle"", ""Bed linens"", ""Heating"", ""Self check-in"", ""Cooking basics"", ""Portable fans"", ""Long term stays allowed"", ""TV"", ""Coffee maker"", ""Elevator"", ""Stove"", ""Wifi"", ""Kitchen"", ""Shampoo"", ""Toaster"", ""Shower gel"", ""Paid parking off premises"", ""Essentials"", ""Dedicated workspace"", ""Body soap"", ""Washer"", ""Room-darkening shades"", ""Hair dryer"", ""Lockbox"", ""Dishes and silverware"", ""Hot water"", ""Clothing storage"", ""Single level home""]",,1,365,1,21,365,365,20.3,365.0,,t,0,0,0,0,2024-09-11,1,1,0,2024-08-03,2024-08-03,4.0,3.0,2.0,5.0,2.0,5.0,3.0,,f,78,64,14,0,0.75
12233,1126847363864521646,https://www.airbnb.com/rooms/1126847363864521646,20240911015603,2024-09-11,city scrape,Ferienzimmer in WG,"Just 20min. to StadtPark, you will be alone as we will all be away for the summer! You can cook, wash, supermarkets within a 10 minute walk, and the Augarten is only a 2 minute walk away. Ideal for singles or couples.<br /><br />Feel free to ask me anything!",,https://a0.muscache.com/pictures/miso/Hosting-1126847363864521646/original/520d980f-ab9e-43bb-a6ed-c5257ac5a120.jpeg,466032597,https://www.airbnb.com/users/show/466032597,Luis Felipe,2022-06-25,,,a few days or more,25%,22%,f,https://a0.muscache.com/defaults/user_pic-50x50.png?v=3,https://a0.muscache.com/defaults/user_pic-225x225.png?v=3,,1.0,1.0,"['email', 'phone']",f,t,,Brigittenau,,48.22779477792638,16.370733740475465,Private room in rental unit,Private room,1,2.0,2 baths,1.0,1.0,"[""Wifi"", ""Washer"", ""Kitchen"", ""Lock on bedroom door"", ""Dedicated workspace""]",$35.00,3,20,3,3,20,20,3.0,20.0,,t,22,48,78,258,2024-09-11,1,1,0,2024-07-24,2024-07-24,4.0,3.0,2.0,3.0,5.0,4.0,3.0,,f,1,0,1,0,0.6
12255,1111522551251260647,https://www.airbnb.com/rooms/1111522551251260647,20240911015603,2024-09-11,city scrape,Parking I Balcony I 5 min to Shopping mall,Experience the perfect fusion of cozy comfort and holiday vibes in our apartment by the Danube.,"Explore the vibrant neighborhood near the Danube River in Vienna, where cool experiences await. Indulge in diverse culinary delights at trendy cafes and restaurants. Discover unique finds at nearby shopping districts and immerse yourself in the lively atmosphere of local markets. Take a leisurely stroll along the picturesque Danube River, or explore cultural gems like the Donauturm. Whether it's trendy eateries, shopping havens, or scenic views, this neighborhood offers an exciting and memorable experience in Vienna.",https://a0.muscache.com/pictures/prohost-api/Hosting-1111522551251260647/original/130c7f92-09e4-4742-953c-9c95bb0ea063.png,566831684,https://www.airbnb.com/users/show/566831684,Mario,2024-03-13,,"Hi! I'm Schildina, a travel enthusiast who loves sharing my passion for travelling with fellow adventurers. My goal is to provide a comfortable, clean, and welcoming space for you.

I'm always happy to offer tips on local spots and hidden gems. Feel free to ask me anything—I'm here to help make your stay memorable!

Looking forward to hosting you!

Best, Schildina",within an hour,100%,98%,f,https://a0.muscache.com/im/pictures/user/User-566831684/original/c9243538-86a5-44cb-982f-47c2e7d2a33c.jpeg?aki_policy=profile_small,https://a0.muscache.com/im/pictures/user/User-566831684/original/c9243538-86a5-44cb-982f-47c2e7d2a33c.jpeg?aki_policy=profile_x_medium,,107.0,138.0,"['email', 'phone']",t,t,"Vienna, Wien, Austria",Donaustadt,,48.24605666426953,16.43905019988137,Entire rental unit,Entire home/apt,4,1.0,1 bath,1.0,1.0,"[""Iron"", ""Bed linens"", ""Heating"", ""Self check-in"", ""High chair"", ""Cooking basics"", ""Carbon monoxide alarm"", ""TV"", ""Coffee maker"", ""Elevator"", ""Stove"", ""Kitchen"", ""Shampoo"", ""Crib"", ""Essentials"", ""Dishwasher"", ""Pack \u2019n play/Travel crib"", ""Washer"", ""Lockbox"", ""Dishes and silverware"", ""Oven"", ""Hot water"", ""Smoke alarm"", ""Refrigerator""]",$107.00,1,1125,1,1,1125,1125,1.0,1125.0,,t,29,59,89,364,2024-09-11,4,4,0,2024-03-29,2024-07-30,3.25,3.75,2.75,3.0,3.25,3.75,3.25,,t,95,95,0,0,0.72
12367,1130339681708154644,https://www.airbnb.com/rooms/1130339681708154644,20240911015603,2024-09-11,city scrape,Wiener Stadthalle Balcony Gem w/ & Full Kitchen,"Central apartment for up to 4 people: Sleek kitchen, private bath, smart TV with Netflix. Walking distance to Wiener Stadthalle Event Center. Close to Lugner City Mall, Mariahilferstrasse Shopping Street, Haus des Meeres, Wien Westbahnhof international train station w/ U3&U6 Metro lines.<br /><br />We offer for FREE:<br /><br />✔ Self-check-in<br />✔ Fast WIFI<br />✔ Smart TV incl. Netflix<br />✔ Parking Garage nearby<br />✔ Coffee Machine<br />✔ Fully equipped kitchen<br />✔ Comfy beds<br />✔ Premium toiletries<br />✔ €2 per booking for charity","This centrally located Vienna studio apartment in the 15th district serves as an ideal hub for exploration, with key attractions easily accessible:<br /><br />✔ Belvedere Palace (4,5 km): Marvel at Baroque elegance and lush gardens.<br />✔ Schönbrunn Palace (3 km): Immerse in imperial splendor and extensive grounds.<br />✔ St. Stephen's Cathedral (5,3 km): Admire the iconic Gothic masterpiece.<br />✔ Hofburg Palace (3 km): Explore Austrian history and culture.<br />✔ Vienna State Opera (3.5 km): Experience world-class performances.",https://a0.muscache.com/pictures/miso/Hosting-1130339681708154644/original/394f3f84-bb90-40ca-a00d-12a4b77af3ff.jpeg,519070229,https://www.airbnb.com/users/show/519070229,Dr. Andre Justin,2023-06-09,"Vienna, Austria",,within an hour,99%,100%,f,https://a0.muscache.com/im/pictures/user/User-519070229/original/e7184a08-a5e2-4be0-ac6c-687d523930d9.jpeg?aki_policy=profile_small,https://a0.muscache.com/im/pictures/user/User-519070229/original/e7184a08-a5e2-4be0-ac6c-687d523930d9.jpeg?aki_policy=profile_x_medium,,29.0,50.0,"['email', 'phone']",t,t,"Vienna, Wien, Austria",Rudolfsheim-Fnfhaus,,48.19932592484348,16.333013896505886,Entire rental unit,Entire home/apt,3,1.0,1 bath,1.0,2.0,"[""Dining table"", ""Hot water kettle"", ""Iron"", ""Bed linens"", ""Heating"", ""Hangers"", ""Self check-in"", ""Outdoor furniture"", ""Portable fans"", ""Freezer"", ""Long term stays allowed"", ""TV"", ""Coffee maker"", ""Stove"", ""Kitchen"", ""Shampoo"", ""Toaster"", ""Shower gel"", ""Paid parking off premises"", ""Essentials"", ""Dedicated workspace"", ""Microwave"", ""Outdoor dining area"", ""Body soap"", ""Room-darkening shades"", ""Backyard"", ""Hair dryer"", ""Lockbox"", ""Patio or balcony"", ""Dishes and silverware"", ""Oven"", ""Hot water"", ""Mini fridge"", ""Clothing storage"", ""Single level home""]",$77.00,1,179,1,5,179,179,4.2,179.0,,t,21,45,75,350,2024-09-11,1,1,1,2024-08-26,2024-08-26,4.0,4.0,2.0,5.0,4.0,3.0,4.0,,t,23,18,5,0,1.0
12810,1173884553167746266,https://www.airbnb.com/rooms/1173884553167746266,20240911015603,2024-09-11,city scrape,Serene Space in 20th Ward,Your family will be close to everything when you stay at this centrally-located place.,,https://a0.muscache.com/pictures/miso/Hosting-1173884553167746266/original/0864d644-d0bf-49c4-a31b-d5fc5f87d9d0.jpeg,571497431,https://www.airbnb.com/users/show/571497431,Abdullah,2024-04-09,,,within an hour,95%,99%,f,https://a0.muscache.com/im/pictures/user/834c30f6-f1e2-46bd-8b0c-cca82c7bc15f.jpg?aki_policy=profile_small,https://a0.muscache.com/im/pictures/user/834c30f6-f1e2-46bd-8b0c-cca82c7bc15f.jpg?aki_policy=profile_x_medium,,18.0,19.0,"['email', 'phone']",t,t,,Brigittenau,,48.2410581,16.3767907,Private room in rental unit,Private room,5,1.0,1 shared bath,1.0,1.0,"[""Wifi"", ""Washer"", ""Kitchen"", ""Self check-in"", ""Lockbox"", ""Lock on bedroom door""]",$86.00,1,365,1,4,365,365,3.4,365.0,,t,30,60,90,100,2024-09-11,3,3,0,2024-06-29,2024-08-04,3.33,3.33,2.67,3.67,3.67,3.67,3.33,,t,18,11,6,1,1.2
12976,1173667110308345207,https://www.airbnb.com/rooms/1173667110308345207,20240911015603,2024-09-11,city scrape,Family Ap. in Brigittenau,Your family will be close to everything when you stay at this centrally-located place.,,https://a0.muscache.com/pictures/miso/Hosting-1173667110308345207/original/faf354c1-a10b-4ff2-b631-167a601262ba.jpeg,571497431,https://www.airbnb.com/users/show/571497431,Abdullah,2024-04-09,,,within an hour,95%,99%,f,https://a0.muscache.com/im/pictures/user/834c30f6-f1e2-46bd-8b0c-cca82c7bc15f.jpg?aki_policy=profile_small,https://a0.muscache.com/im/pictures/user/834c30f6-f1e2-46bd-8b0c-cca82c7bc15f.jpg?aki_policy=profile_x_medium,,18.0,19.0,"['email', 'phone']",t,t,,Brigittenau,,48.2410581,16.3767907,Entire rental unit,Entire home/apt,5,1.0,1 bath,2.0,2.0,"[""Wifi"", ""Kitchen"", ""Washer""]",$98.00,1,365,1,4,365,365,3.4,365.0,,t,30,60,90,99,2024-09-11,2,2,1,2024-08-04,2024-08-25,3.5,2.5,2.5,5.0,4.0,4.0,2.0,,t,18,11,6,1,1.54
13048,1177617674797112155,https://www.airbnb.com/rooms/1177617674797112155,20240911015603,2024-09-11,city scrape,Perfect room in shared Apt with Great Location,"The property is a cozy room in a 4 bedroom apartment for up to three guests. Conveniently nestled near Augarteb & Prater park featuring the Wiener Riesenrad (Giant Ferris Wheel), it promises a blend of comfort and accessibility for your stay.<br /><br />We offer for FREE:<br /><br />✔ Self-check-in<br />✔ Terrace<br />✔ Quality toiletries<br />✔ Cozy beds and pillows <br />✔ Shared kitchen, WCs, bathroom<br />✔ 2€ per booking donated to charity","In this centrally located place, you'll find an array of captivating attractions right at your doorstep. Here are some highlights:<br /><br />✔ Augarten (10 mins by foot)<br />✔ Prater (20 mins by foot)<br />✔ St. Stephen's Cathedral (15 mins by transportation)<br />✔ Hofburg Palace (20 mins by transportation)<br />✔ MuseumsQuartier (25 mins by transportation)<br /><br />Immerse yourself in Vienna's rich cultural heritage as you explore these iconic landmarks, all conveniently situated nearby.",https://a0.muscache.com/pictures/miso/Hosting-1177617674797112155/original/6fdd31fd-6229-4ed5-b4e3-5d78f61c4154.jpeg,449098419,https://www.airbnb.com/users/show/449098419,Jonas,2022-03-11,"Vienna, Austria",,within an hour,99%,99%,f,https://a0.muscache.com/im/pictures/user/User-449098419/original/fceb8418-b13a-4566-9a15-d7fcbc4f06b0.jpeg?aki_policy=profile_small,https://a0.muscache.com/im/pictures/user/User-449098419/original/fceb8418-b13a-4566-9a15-d7fcbc4f06b0.jpeg?aki_policy=profile_x_medium,,144.0,297.0,"['email', 'phone']",t,t,"Vienna, Wien, Austria",Leopoldstadt,,48.22212610172415,16.38605400587475,Private room in rental unit,Private room,3,1.5,1.5 shared baths,1.0,2.0,"[""Dining table"", ""Hot water kettle"", ""Bathtub"", ""Bed linens"", ""Heating"", ""Hangers"", ""Self check-in"", ""Long term stays allowed"", ""Stove"", ""Kitchen"", ""Shampoo"", ""Shower gel"", ""Paid parking off premises"", ""Essentials"", ""Lock on bedroom door"", ""Dedicated workspace"", ""Microwave"", ""Body soap"", ""Washer"", ""Room-darkening shades"", ""Hair dryer"", ""Lockbox"", ""Patio or balcony"", ""Dishes and silverware"", ""Oven"", ""Hot water"", ""Refrigerator"", ""Single level home""]",$43.00,1,179,1,5,179,179,4.2,179.0,,t,22,22,22,22,2024-09-11,3,3,0,2024-07-08,2024-08-06,3.33,3.33,2.33,4.0,4.0,3.0,2.67,,t,134,48,85,1,1.36
13284,1189208325386035123,https://www.airbnb.com/rooms/1189208325386035123,20240911015603,2024-09-11,city scrape,Central SKY rooftop deck & bamboo DREAM canopy bed,"Large room in our apartment with rooftop terrace, living room, working area with 250Mbit/s WiFi & dreamlike bamboo four-poster bed<br /><br />The apartment is located at the station ""U4 Meidling Hauptstraße"" which makes the city center reachable in a few minutes<br /><br />Supermarkets, shopping street, restaurants – all nearby. In addition, there is an amazing rooftop terrace with 360° view over the rooftops of Vienna<br /><br />Couples, solo adventurers, and business travelers are welcome here! (:",,https://a0.muscache.com/pictures/hosting/Hosting-U3RheVN1cHBseUxpc3Rpbmc6MTE4NDgyMzE0NTM2NDA3NDUzOQ%3D%3D/original/649c4846-84bd-4af8-93f7-6eb58e354f0b.jpeg,575632090,https://www.airbnb.com/users/show/575632090,John,2024-05-03,,"Not traveling is like skipping a page in life. It's always breathtaking to discover new places or meet new people.

Making your stay enchanting is my ultimate goal – Welcome!
Best regards,
John & Natie",within an hour,100%,98%,f,https://a0.muscache.com/im/pictures/user/User-575632090/original/2053e718-3b5c-47dd-bf5e-2e8f43a83fd9.jpeg?aki_policy=profile_small,https://a0.muscache.com/im/pictures/user/User-575632090/original/2053e718-3b5c-47dd-bf5e-2e8f43a83fd9.jpeg?aki_policy=profile_x_medium,,6.0,6.0,"['email', 'phone']",t,t,,Rudolfsheim-Fnfhaus,,48.18482874410734,16.33367657661438,Private room in rental unit,Private room,2,2.0,2 shared baths,1.0,1.0,"[""Drying rack for clothing"", ""Dining table"", ""Hot water kettle"", ""Cleaning products"", ""First aid kit"", ""Iron"", ""Bed linens"", ""Heating"", ""Hangers"", ""Self check-in"", ""Cooking basics"", ""Cleaning available during stay"", ""Outdoor furniture"", ""Portable fans"", ""Freezer"", ""Coffee maker"", ""Elevator"", ""Stove"", ""Dryer"", ""Kitchen"", ""Free street parking"", ""Fast wifi \u2013 276 Mbps"", ""Paid parking off premises"", ""Dishwasher"", ""Lock on bedroom door"", ""Fire extinguisher"", ""Dedicated workspace"", ""Wine glasses"", ""Outdoor dining area"", ""Washer"", ""Body soap"", ""Room-darkening shades"", ""Backyard"", ""Hair dryer"", ""Theme room"", ""Patio or balcony"", ""Air conditioning"", ""Dishes and silverware"", ""Ceiling fan"", ""Board games"", ""Baking sheet"", ""Laundromat nearby"", ""Oven"", ""Hot water"", ""Smart lock"", ""Smoke alarm"", ""Private living room"", ""Refrigerator"", ""Books and reading material"", ""Clothing storage""]",$156.00,1,14,1,1,1125,1125,1.0,1125.0,,t,2,2,2,2,2024-09-11,2,2,2,2024-08-18,2024-09-06,3.5,4.0,2.0,5.0,5.0,4.0,4.0,,t,6,2,4,0,2.0
13468,1204090818394993913,https://www.airbnb.com/rooms/1204090818394993913,20240911015603,2024-09-11,city scrape,"Central Spacious 2Br Apt, 7- Min to Westbahnhof","Comfortable 71m² - 2-bedroom apartment with a fully equipped kitchen & bathroom. Suitable for up to 5 guests. Just 4 minutes to ""Wiener Stadthalle"" 7 minutes to Westbahnhof, and near the Kunsthistorisches Museum, Metro Station U6 Burggasse, & Lugner City Shopping Center. Enjoy nearby shopping, dining, & cultural attractions in central Vienna.<br /><br />We offer for FREE:<br /><br />✔ Self-Check-In<br />✔ High-Speed Internet<br />✔ Parking Nearby<br />✔ High-Quality Toiletries<br />✔ Fully Equipped Kitchen<br />✔ €2 Per Booking for Charity","In this conveniently located place, you'll find an array of captivating attractions right at your doorstep. Here are some highlights:<br /><br />- 3 beautiful parks: Vogelweidpark, Märzpark, Emil Maurer Park (5 min walking range) - Perfect for a leisurely stroll or a relaxing afternoon picnic.<br /><br />- Lugner City Shopping Center (4 min walk) - A bustling mall with shops, restaurants, and a cinema for all your shopping and entertainment needs.<br /><br />- Wiener Stadthalle (4 min walk) - Vienna's premier event hall hosting concerts, sports events, and exhibitions.<br /><br />- Wien Westbahnhof (7 min walk) - One of the main railway stations in Vienna, providing excellent transport links.<br /><br />- Haus des Meeres (10 min drive) - A fascinating aquarium and terrarium showcasing marine life, reptiles, and more.<br /><br />- Stadthallen Bad (6 min walk) - A popular swimming pool complex, ideal for a refreshing dip or some family fun.<br /><br />Other important places that are reac",https://a0.muscache.com/pictures/hosting/Hosting-U3RheVN1cHBseUxpc3Rpbmc6MTIwNDA5MDgxODM5NDk5MzkxMw%3D%3D/original/53167ee9-b6d6-4e57-81a5-fa4c9cf88167.jpeg,449098419,https://www.airbnb.com/users/show/449098419,Jonas,2022-03-11,"Vienna, Austria",,within an hour,99%,99%,f,https://a0.muscache.com/im/pictures/user/User-449098419/original/fceb8418-b13a-4566-9a15-d7fcbc4f06b0.jpeg?aki_policy=profile_small,https://a0.muscache.com/im/pictures/user/User-449098419/original/fceb8418-b13a-4566-9a15-d7fcbc4f06b0.jpeg?aki_policy=profile_x_medium,,144.0,297.0,"['email', 'phone']",t,t,"Vienna, Wien, Austria",Neubau,,48.19934,16.33916,Entire rental unit,Entire home/apt,5,1.5,1.5 baths,2.0,4.0,"[""Drying rack for clothing"", ""Dining table"", ""Hot water kettle"", ""Bathtub"", ""Bed linens"", ""Heating"", ""Hangers"", ""Self check-in"", ""Cooking basics"", ""Portable fans"", ""Freezer"", ""Long term stays allowed"", ""Coffee maker"", ""Stove"", ""Private entrance"", ""Kitchen"", ""Shampoo"", ""Toaster"", ""Paid parking off premises"", ""Essentials"", ""Dedicated workspace"", ""Microwave"", ""Body soap"", ""Washer"", ""Room-darkening shades"", ""Hair dryer"", ""Lockbox"", ""Dishes and silverware"", ""Oven"", ""Hot water"", ""Refrigerator"", ""Clothing storage"", ""Single level home""]",$81.00,1,179,1,5,179,179,4.2,179.0,,t,25,55,85,360,2024-09-11,9,9,5,2024-07-21,2024-09-08,3.22,3.44,2.67,3.78,3.89,3.56,3.22,,t,134,48,85,1,5.09
